,Time,Tweet Id,Username,Text,LikeCount,ReplyCount,Retweet,Date
0,2020-05-29 14:22:14+00:00,1266374295535538176,GoodPersonCoin,İnsanların fiziksel özelliklerine ve kişisel özelliklerine göre puan toplayabilecekleri bir mobil uygulama ile topladıkları skorlara göre coin kazanabilecekleri bir sistem. Kazandıkları bu koinleri daha sonra paraya çevirebilecekler. Ya da alışverişte kullanabilecekler.,2,0,1,2020-05-29
2,2020-06-01 07:51:37+00:00,1267363155321257986,GoodPersonCoin,Proje özet tanıtımı sayfamızın Türkçe ilk versiyonu yayınlandı. https://t.co/mACtD2pKsH,0,0,1,2020-06-01
4,2021-04-12 12:19:16+00:00,1381582690701471749,GoodPersonCoin,Mobil Uygulamamızın android ve ios versiyonlarının geliştirilmesi için teknik izhnameyi hazırladık. Yazılım ekibiyle prensipte anlaştık. İmzalar atılınca fotoğraf paylaşacağız. 12.04.2021,4,0,0,2021-04-12
5,2021-04-14 16:32:26+00:00,1382371177495203842,GoodPersonCoin,"Telegram Grubumuza katılarak gelismeleri ve airdrop duyurularını takip edebilirsiniz 
https://t.co/qfUgbiglVx",4,0,2,2021-04-14
6,2021-04-22 22:06:35+00:00,1385354373258260481,GoodPersonCoin,"Google Analitics'e göre ilk iki ziyaretçimizi ağırlıyoruz:
Acaba kimler 🥰 https://t.co/qK9F9J5JUd",5,1,1,2021-04-22
7,2021-04-23 19:16:42+00:00,1385674008830558209,GoodPersonCoin,"GPCX Economic Business Model

https://t.co/SY3DnwVnBA https://t.co/xgSqNf6VGE",3,1,3,2021-04-23
13,2021-04-25 11:02:13+00:00,1386274340182888452,GoodPersonCoin,Good Person Coin Projemizin özeti. #GPCX https://t.co/7e4lBgmbSa,6,0,1,2021-04-25
17,2021-04-26 17:50:07+00:00,1386739382372155398,GoodPersonCoin,"@emremert917 Emre Bey twitter hesabımızı takibe alarak, sitemize üye kaydınızı tamamlayınız. Zaten üyeyseniz, takibinizden sonra twitterdan size DM ile ulaşacağız.",0,0,0,2021-04-26
24,2021-04-30 12:46:59+00:00,1388112648458354691,GoodPersonCoin,The purpose of our project: Creating better people for a better future.  Support us for a better world.  Good people are there?  Follow for support. #gpcx #Crypto #Bitcoin https://t.co/QIS9JXgV5h,7,2,2,2021-04-30
26,2021-05-21 14:54:15+00:00,1395754818954829825,GoodPersonCoin,"IcoMarks sitesi ön satışımızı sitesine ekledi :
https://t.co/aSPDDt8wJy",5,0,2,2021-05-21
29,2021-05-22 09:32:59+00:00,1396036357596880898,GoodPersonCoin,"Good Person Coin sitesinde GPCX ÖN SATIŞINA nasıl katılırım? https://t.co/JkRoWPt2Gw 
Türkçe Anlatım.",6,0,1,2021-05-22
30,2021-05-23 11:08:00+00:00,1396422656140906497,GoodPersonCoin,"How do I participate in the GPCX PRE-SALES on the ""Good Person Coin"" site?
https://t.co/MZ7AeQ28S6",3,0,1,2021-05-23
31,2021-05-24 09:15:21+00:00,1396756694638682114,GoodPersonCoin,"The number of our visitors is very low. But anyway, we continue to work. When we launch our mobile applications, we will focus on promotional activities to increase interest. Those who have been with us since the first day will receive their rewards. https://t.co/eUJpYvIG0K",7,0,1,2021-05-24
32,2021-05-26 19:26:09+00:00,1397635185294942210,GoodPersonCoin,"icoholder site listed GPCX pre-sale 
https://t.co/6r96oPjgIG",2,0,1,2021-05-26
34,2021-06-02 07:58:01+00:00,1399998723292385283,GoodPersonCoin,Dünyanın bütün ülkelerinden ziyaretçilerimiz olması dileğiyle. https://t.co/Lhi0184Qu7,3,0,0,2021-06-02
35,2021-07-07 20:26:44+00:00,1412870723304046599,GoodPersonCoin,"Tebrikler #Akbank 48 saatte ATM'leri çalışır hale getirdiniz.
48 saate de internet bankacılığını çalıştırırsanız size ""Yılın en iyi dijital bankası"" ödülünü vereceğiz. https://t.co/9JTlKSaMll",5,0,1,2021-07-07
36,2022-01-04 08:29:42+00:00,1478282479383502849,GoodPersonCoin,@KevinLuigi7 Thank you.,1,0,0,2022-01-04
37,2022-03-26 11:29:20+00:00,1507681098947604480,GoodPersonCoin,#Bitcoin 44444 👏 https://t.co/IiOUyxswi8,0,0,0,2022-03-26
38,2022-04-18 15:05:24+00:00,1516070398424715266,GoodPersonCoin,23 Nisan 2022 tarihinde Good Person Coin https://t.co/g4XX2v37qB borsasında GPCX/USDT çifti ile listelenecek.,3,0,1,2022-04-18
40,2022-04-19 13:05:38+00:00,1516402645489049602,GoodPersonCoin,"By registering on the TxBit Exchange, you can buy #GPCX at the opening price ($0.001) on April 23, 2022.",1,0,0,2022-04-19
41,2022-04-20 03:59:23+00:00,1516627565003292675,GoodPersonCoin,@Binance_Turkish #Gpcx #GoodPersonCoin,0,0,0,2022-04-20
43,2022-04-21 14:54:04+00:00,1517154706455339008,GoodPersonCoin,"23 Nisan tarihinde https://t.co/f9HWqEDVFt borsasında listelenecek olan @GoodPersonCoin'e yatırım yaparak 0.001 fiyattan #GPCX alabilirsiniz.

#bitcoin #Ethereum #altcoin #altcoins #cryptocurrency #CryptoNews #blockchain #altcoinler #kriptopara #Vakıf #xu100 #dolar #halkb",2,2,1,2022-04-21
44,2022-04-23 14:14:05+00:00,1517869422316331011,GoodPersonCoin,"https://t.co/U6Woa1RN71

#Gpcx #txbit #cryptocurrency #alcoin #altcoins #crypto #cryptonews #bitcoin #ethereum https://t.co/yXICdFAo6J",2,2,1,2022-04-23
45,2022-04-25 13:18:19+00:00,1518580162077544449,GoodPersonCoin,"Bugün https://t.co/f9HWqEmkNV borsasında fiyatı artan koinlere girdik. Küçük yatırımlarla da olsa bizleri destekleyen herkese teşekkürler.

https://t.co/U6Woa1RN71 https://t.co/4pd5mWcBIx",2,0,1,2022-04-25
47,2022-04-26 10:16:40+00:00,1518896838618853376,GoodPersonCoin,@IcsScience Wallet address incorrect. Please check it. https://t.co/JkWuGPVxB9,0,0,0,2022-04-26
54,2022-04-27 15:02:09+00:00,1519331067978817538,GoodPersonCoin,"Artık #CoinGecko'da varız. Teşekkürler.
https://t.co/6N3Zf5yYty",1,0,0,2022-04-27
57,2022-04-28 15:35:28+00:00,1519701842950770690,GoodPersonCoin,@kucoincom #Gpcx,1,0,0,2022-04-28
58,2022-04-29 14:15:11+00:00,1520044024090050560,GoodPersonCoin,@kucoincom #Gpcx,5,1,0,2022-04-29
59,2022-04-30 02:06:28+00:00,1520223027694350337,GoodPersonCoin,"Thank you Stock Investor for this promotional video :
https://t.co/4zSjXsQzcQ

#Gpcx #Coins #CryptoNews #cryptocurrency #Crypto #bitcoin #Ethereum #WhatsApp #Istanbul",12,1,3,2022-04-30
62,2022-05-01 16:42:59+00:00,1520805998566559745,GoodPersonCoin,The patient investor eventually wins. #Gpcx,8,1,2,2022-05-01
67,2022-05-02 17:54:07+00:00,1521186285309861888,GoodPersonCoin,@boita_isabela @honest_abeNFT @PopaCatalinMar1 Sorry for the delay. 5 min. We will send your gift within.,1,0,0,2022-05-02
73,2022-05-03 15:25:03+00:00,1521511161262444546,GoodPersonCoin,"https://t.co/LXXpYlUdQy
Thank you The Hdgr

#cryptonews #crypto #coin #coinmarketcap #coingecko #cryptocurrency #Altcoins #bitcoin #ethereum #bist #usdt",5,0,2,2022-05-03
74,2022-05-04 20:08:17+00:00,1521944823867097089,GoodPersonCoin,"@c0insbit As the Good Person family, we are happy and proud to be listed on #Coinsbit.  #GPCX",3,0,0,2022-05-04
75,2022-05-05 07:07:32+00:00,1522110732116324352,GoodPersonCoin,"#GPCX Deposits and Withdrawals are open on #Coinsbit

#newlisting #cryptonews #cryptocommunity https://t.co/MffTeEeoMR",2,0,0,2022-05-05
77,2022-05-06 11:26:39+00:00,1522538327383191554,GoodPersonCoin,@Brunakhanok Good Person Coin #GPCX,1,0,0,2022-05-06
81,2022-05-07 12:31:51+00:00,1522917125433827328,GoodPersonCoin,@txbit_io of course #GPCX Good Person Coin,2,0,0,2022-05-07
82,2022-05-08 00:53:57+00:00,1523103880149495808,GoodPersonCoin,"The #GPCX trading competition will start on the Coinsbit Exchange on 10.05.2022.  Details coming soon.
https://t.co/MsD5fDLhAd https://t.co/NjYrX3eEwK",3,0,1,2022-05-08
84,2022-05-10 02:53:00+00:00,1523858617350475776,GoodPersonCoin,"Investors who are patient will win sooner or later.
#GPCX #Bitcoin #USDT",3,0,2,2022-05-10
86,2022-05-13 14:21:36+00:00,1525119072609902593,GoodPersonCoin,"1000$a eşit #GPCX dağıttığımız Ticaret Yarışmasına Katılmak için videoyu izle
https://t.co/TEesJf7vYH 
⏰BAŞLAMA 12.05.2022 TSİ 21:00
 💥 BİTİŞ 22.05.2022 TSİ 21:00 
🥇1 inci 500 000 GPCX
🥈2 inci 300.000 GPCX
🥉3 üncü 200 000 GPCX
#Coinsbit #KriptoPara #bitcoin #CryptoNews #USDT",5,0,3,2022-05-13
89,2022-05-14 12:14:42+00:00,1525449525422432256,GoodPersonCoin,"Trade Contest with 1,000,000 #GPCX prizes continues.  Sign up for #Coinsbit to participate.

#airdrop #giveways #CryptoNews #bitcoin #ethereum #NFT #metaverse #finance #usdt",8,1,3,2022-05-14
91,2022-05-15 05:36:53+00:00,1525711796950159361,GoodPersonCoin,"🔥 HOT NEWS 🔥 
1.000.000 #GPCX Trading Competition continues on #Coinsbit
https://t.co/WntakkCxpu

#bitcoin #Airdrop #Giveaway #CryptoNews #nft #trx #bnb #Eurovision #nato #usdt",6,0,5,2022-05-15
92,2022-05-16 08:26:52+00:00,1526116961234690048,GoodPersonCoin,#Gpcx Token Top Trader https://t.co/6ULBJX9EDd,2,0,1,2022-05-16
93,2022-05-17 21:00:26+00:00,1526668991640612870,GoodPersonCoin,"Dear @elonmusk , what are your thoughts on the #GPCX Token?",5,0,1,2022-05-17
94,2022-05-18 10:16:42+00:00,1526869380398821377,GoodPersonCoin,"Gpcx Token ekibi olarak, 19 Mayıs Atatürk'ün Anma Gençlik ve Spor Bayramı'nızı kutluyoruz.",6,0,2,2022-05-18
96,2022-05-19 04:07:23+00:00,1527138826208133120,GoodPersonCoin,"We will give away 50,000 #GPCX to our 50,000th followers.",5,0,2,2022-05-19
98,2022-05-21 11:56:41+00:00,1527981703079370754,GoodPersonCoin,"#GPCX Token Trading Competition continues on #Coinsbit 
Last 30 Hours !!! https://t.co/tj6lYxZzS5",3,0,0,2022-05-21
100,2022-05-22 03:04:37+00:00,1528210194588655618,GoodPersonCoin,"This is how Good Person Coin will rise in 2023
                                           🌕
                                      🚀
                                🚀
                          🚀
                    🚀
              🚀
         🚀
    🚀
🌍  
☝️
🔥 #GPCX 🔥",7,0,1,2022-05-22
103,2022-05-25 19:15:05+00:00,1529541583166644228,GoodPersonCoin,@mariapazdelgado Happy birthday to you.,1,0,0,2022-05-25
107,2022-05-27 13:12:53+00:00,1530175205963878402,GoodPersonCoin,"#GPCX Token Price Prediction. 
AI has underestimated us. 🤣 https://t.co/tTjqyzHI8U",7,1,1,2022-05-27
108,2022-06-01 10:13:41+00:00,1531942050173689857,GoodPersonCoin,@MartiniGuyYT #GPCX Good Person Coin,1,0,0,2022-06-01
110,2022-06-02 07:36:41+00:00,1532264927406211072,GoodPersonCoin,"@cz_binance President, why isn't this FTX replying to our emails?",0,0,0,2022-06-02
114,2022-06-03 09:33:57+00:00,1532656827518918658,GoodPersonCoin,@GoingParabolic #bitcoin has no CEO,1,1,0,2022-06-03
115,2022-06-06 05:53:15+00:00,1533688449605242885,GoodPersonCoin,"Thanks to #CoinMarketCap for adding #GPCX to the price watch list.

https://t.co/yOYOQ7NKNI

@CoinMarketCap",4,0,3,2022-06-06
117,2022-06-07 20:46:33+00:00,1534275643063640065,GoodPersonCoin,* 7.6.22,0,0,0,2022-06-07
120,2022-06-08 15:41:13+00:00,1534561191812550657,GoodPersonCoin,"Thanks #Coincu

https://t.co/puEdrHlsgH",4,0,1,2022-06-08
121,2022-06-09 07:37:23+00:00,1534801818491953153,GoodPersonCoin,"Bugün CoinMarketcap çok kazananlar listesine girdik: 
https://t.co/HKfyA7MtuL https://t.co/rfYCK3Lm9w",10,0,4,2022-06-09
123,2022-06-12 20:22:37+00:00,1536081559526187008,GoodPersonCoin,@CryptoWendyO Impossible,0,0,0,2022-06-12
124,2022-06-14 07:26:06+00:00,1536610919828099072,GoodPersonCoin,Bugün #TxBit Borsasında #USDT çiftlerinde #GPCX Token 2. sıraya yerleşti. https://t.co/ksSEtNtjRq,5,1,3,2022-06-14
128,2022-06-18 21:08:45+00:00,1538267496310087680,GoodPersonCoin,"#BTCUSDT 17.000$'a dayandı. 1 yıl boyunca düşecek deyip de 30K'ya düşünce ""bakın haklı çıktım"" diyen @greeneconomyy rengini kırmızıdan yeşile çevirip ""artık yükseliş bekliyorum"" demişti. Demek ki neymiş, o çizdiğiniz grafikler, çizgiler teknik analizler hepsi saçmalıkmış
#bitcoin",7,1,1,2022-06-18
129,2022-06-21 10:35:31+00:00,1539195302573400064,GoodPersonCoin,#GPCX rose to #1 on the most traded list on #Txbit exchange today. https://t.co/kNUEfCHdzx,4,0,2,2022-06-21
131,2022-07-06 09:19:14+00:00,1544611924050067456,GoodPersonCoin,@ProfesorTurkmen Good Person Coin al keyfine bak. #GPCX,3,1,0,2022-07-06
132,2022-07-09 09:58:23+00:00,1545708939869814784,GoodPersonCoin,@haluklevent Ooo Halukçuğum yazı getirmişsin,0,0,0,2022-07-09
134,2022-07-17 19:52:44+00:00,1548757616188428291,GoodPersonCoin,"I was born in such a wonderful time that I saw the pure, clean and simple life of the past, and the age of technology making everything worthless and meaningless.",3,0,0,2022-07-17
135,2022-07-18 18:26:35+00:00,1549098320605372416,GoodPersonCoin,@WatcherGuru #Bitcoin can go as low as 15K.,1,0,1,2022-07-18
138,2022-07-21 18:00:11+00:00,1550178843901804544,GoodPersonCoin,"#Bitmart or #XT, do you think a bigger exchange?
#Cryptocurrency #Bitcoin #Ethereum #GPCX",2,1,0,2022-07-21
139,2022-07-25 14:52:59+00:00,1551581281829412864,GoodPersonCoin,@saylor Are you sure?,0,0,0,2022-07-25
146,2022-07-27 06:53:07+00:00,1552185295323688960,GoodPersonCoin,"How much do you think the #Fed will raise interest rates?

#GPCX #Bitcoin #Ethereum #Crypto #cryptocurrecy #CryptoNews #usd #usdt #earthquake #sanal #gold",6,2,3,2022-07-27
147,2022-07-28 06:10:47+00:00,1552537028650323969,GoodPersonCoin,It's just a rocket builder thinking he's a god. https://t.co/kgXmRMuUFH,4,0,0,2022-07-28
148,2022-07-30 09:37:24+00:00,1553313801738395648,GoodPersonCoin,@kucoincom #GPCX,0,0,0,2022-07-30
149,2022-08-04 06:37:06+00:00,1555080370009300992,GoodPersonCoin,#GPCX New Listing on #Bitmart : https://t.co/yqwGlmOMWs,9,1,4,2022-08-04
150,2022-08-11 11:13:07+00:00,1557686545578172416,GoodPersonCoin,"What is ""Good Person Coin"" project #GPCX   ? https://t.co/C1rYN4v3sy",7,2,4,2022-08-11
152,2022-08-13 12:58:54+00:00,1558437942141636609,GoodPersonCoin,#GPCX wallet activated on #Bitmart. https://t.co/sTXqUB3Ama,6,1,1,2022-08-13
153,2022-08-15 10:21:43+00:00,1559123162792599552,GoodPersonCoin,#GPCX Token #Bitmart Listing 40 minutes left.  Do not miss the opportunity to become an early investor. https://t.co/wT9NJ2kmGG,5,0,3,2022-08-15
154,2022-08-16 16:59:40+00:00,1559585694883913728,GoodPersonCoin,Star of the day #GPCX  ❤️ https://t.co/wYnQEQgapZ,5,0,3,2022-08-16
155,2022-08-17 13:47:11+00:00,1559899646536859648,GoodPersonCoin,#Bitmart exchange proudly presents: #GPCX https://t.co/HcWxDWG5fP,6,0,4,2022-08-17
157,2022-08-19 16:58:46+00:00,1560672634794541057,GoodPersonCoin,"#GPCX sweetest of the day on #Bitmart
Bitcoin
#Bitcoin
#Ethereum
#kripto
#newlisting 
#CryptoNews https://t.co/LXSbZQwjuG",7,4,5,2022-08-19
158,2022-08-20 17:18:12+00:00,1561039912287215619,GoodPersonCoin,"#Gpcx 🌻 flower of the day on #Bitmart
#Bitcoin 
#Ethereum
#NewListing
#CryptoNews
#Kriptopara
#Hotnews https://t.co/YMiIt8VpIG",5,2,3,2022-08-20
159,2022-08-21 12:07:34+00:00,1561324126274347008,GoodPersonCoin,"#GPCX honey of the day on #Bitmart 21.08.2022
#Bitcoin
#Ethereum
#NewListing
#HotNews
#CryptoCurrency
#KriptoPara
#USDT https://t.co/iFU5KW8Mxj",5,3,3,2022-08-21
160,2022-08-22 14:56:57+00:00,1561729141925371905,GoodPersonCoin,"#GPCX gave a buying opportunity today.
#Bitmart
#Bitcoin
#Ethereum 
#NewListing
#CrptoNews
#Kriptopara
#USDT
#HotNews https://t.co/MLfZkIDUdZ",2,2,1,2022-08-22
161,2022-08-23 18:59:44+00:00,1562152629211471872,GoodPersonCoin,"#GPCX decrease notification 10%
#Bitmart #Bitcoin #Ethereum #CryptoNews #NewListing #Hotnews #Lunc #Ripple #kriptopara #ALTİN https://t.co/JftJYbQXe1",6,3,4,2022-08-23
162,2022-08-24 14:46:32+00:00,1562451294908219392,GoodPersonCoin,#GPCX sweet of the day on #Bitmart #Bitcoin #ethereum #CryptoNews #NewListing #HotNews #CryptoCurrency #KriptoPara #Usdt Binance Macron https://t.co/IX0DJPYknS,4,5,2,2022-08-24
163,2022-08-26 03:14:26+00:00,1563001900047290372,GoodPersonCoin,"#GPCX 0.001245$ memory of the day on #Bitmart
#Bitcoin 
#Ethereum 
#ChampionsLeague 
#CryptoNews
#NewListing
#HotNews
#KriptoPara
#USDT
#Dollar https://t.co/1DXMN9nFko",6,3,2,2022-08-26
165,2022-08-27 11:12:15+00:00,1563484532724342784,GoodPersonCoin,"#GPCX star ⭐️ of the day on #Bitmart ⭐️
27.08.2022 
#Bitcoin #Ethereum #newlisting #HotNews #cryptocurrency #CryptoNews #KriptoPara #USDT https://t.co/EJHNrkVXQD",5,2,4,2022-08-27
166,2022-08-28 09:52:24+00:00,1563826825238904839,GoodPersonCoin,@DigiFinex #GPCX,0,0,0,2022-08-28
168,2022-08-29 05:33:39+00:00,1564124098585919488,GoodPersonCoin,"#GPCX Green of the day on #Bitmart
29.08.2022 Gpcx price 0.001266$
#USDT #Bitcoin #Ethereum #CryptoCurrency #Kriptopara #NewListing #HotNews #Avax #BillGates #USDTRT #Tether https://t.co/KQ5uTkiaAW",6,2,3,2022-08-29
169,2022-08-30 05:23:23+00:00,1564483901111894016,GoodPersonCoin,"Baby of the day #GPCX on #Bitmart
30.08.2022 GPCX price 0.00128$
#NewListing #HotNews #Crypto #Kripto #CryptoCurrency #KriptoPara #USDT #Tether #UsdTry #Avax #USOpen #Bitcoin #Ethereum #VMAs https://t.co/AuJyXRBz5L",5,5,8,2022-08-30
170,2022-08-31 15:15:15+00:00,1564995239017865218,GoodPersonCoin,"#GPCX Red of the day on #Bitmart
31.08.2022 Gpcx price 0.001277$
#USDT #Bitcoin    #Ethereum #CryptoCurrency #Kriptopara #NewListing #HotNews #Avax    #BillGates #USDTRY #Tether https://t.co/2f6NZadh0C",4,2,2,2022-08-31
171,2022-09-01 04:31:10+00:00,1565195536004792321,GoodPersonCoin,"#GPCX Price 0.001278 #USDT 
You can trade on #Bitmart
#Bitcoin #ethereum #cryptocurrency #kriptopara #newlistings #hotnews #JpMorgan #ElonMusk #BillGates #MicroStrategy #Bukele https://t.co/iNplmfjDDX",3,1,2,2022-09-01
172,2022-09-02 15:10:17+00:00,1565718761520463874,GoodPersonCoin,"#GPCX is the only Token that responds correctly to ABD data.  You can get it from #Bitmart.
#Bitcoin #Ethereum #NewListing #HotNews #CeyptoNews #CryptoCurrency #KriptoPara #Tether #USD https://t.co/GrJC8fD7sw",4,1,3,2022-09-02
173,2022-09-04 14:20:52+00:00,1566431102935482375,GoodPersonCoin,"💎 #GPCX Gem 💎 of the day on #Bitmart
04.09.2022 Gpcx price 0.001499$
#USDT #Bitcoin       #Ethereum #CryptoCurrency #Kriptopara #NewListing #HotNews #CryptoNews #BillGates #USDTRY #Tether   #USD #Bist #Ukrainia https://t.co/nJH3ImrEA9",3,2,0,2022-09-04
175,2022-09-07 19:31:00+00:00,1567596313352486912,GoodPersonCoin,"#GPCX price 0.001504 #USDT on #Bitmart
#Bitcoin #Ethereum #NewListing #HotNews #CryptoCurrency #KriptoPara https://t.co/ex8ft4pBCe",3,1,2,2022-09-07
176,2022-09-11 14:26:57+00:00,1568969350396219392,GoodPersonCoin,"#GPCX price 0.001518 #USDT on #Bitmart 
11.09.2022
#Bitcoin    #Ethereum #NewListing #HotNews #CryptoCurrency #KriptoPara https://t.co/SRGZKs5q6h",3,2,1,2022-09-11
177,2022-09-13 06:14:29+00:00,1569570193529077760,GoodPersonCoin,"#GPCX has lost value against #bitcoin.  Still, he managed to secure his place in the top 1,000
#NewListing #cryptocurrency #CryptoNews #HotNews https://t.co/RQqzgyyaLV",5,1,3,2022-09-13
179,2022-09-14 07:56:50+00:00,1569958335746813954,GoodPersonCoin,"#GPCX star of the day on #Bitmart
14.09.2022 GPCX price 0.001531 #USDT
#Bitcoin #Ethereum #NewListing #Hotnews #CryptoNews #CryptoCurrency #KriptoPara #ZamGeldi #Luna #Toki #adana #Kapadokya #Borsaistanbul #akyaka #usdtry 
#Bist100 #Gem https://t.co/KMlZE2vsh2",6,5,3,2022-09-14
181,2022-09-15 07:55:11+00:00,1570320307717607424,GoodPersonCoin,"Testing and revision processes of our mobile applications continue. On September 22, our Beta version will be opened for user testing.",4,0,2,2022-09-15
182,2022-09-16 18:48:58+00:00,1570847227840729091,GoodPersonCoin,"Good Person Coin #GPCX on #Bitmart
16.09.2022 Gpcx Price 0.00153 https://t.co/PALM0dCd8q",3,0,1,2022-09-16
183,2022-09-19 11:06:41+00:00,1571818053700132866,GoodPersonCoin,"#GPCX price 0.001534 #USDT on #Bitmart
19.09.2022 #Bitcoin #Ethereum #Etherum #Ripple #Vakbn #ösym #hotnews #cryptonews #NewListing #KriptoPara #CryptoCurrency https://t.co/XXU0qBtHAW",4,1,2,2022-09-19
184,2022-09-20 10:37:17+00:00,1572173043996172289,GoodPersonCoin,"#GPCX continues to move forward with small but solid steps.  You can trade on #Bitmart.
20.09.2022 Gpcx price 0.001534 #USDT 
#Bitcoin #Ethereum #dolar #vakbn #bist #crypto #kriptopara #NewListing #HotNews #CryptoCurrency #Avax #akbnk #Fed #USDTRY https://t.co/TrxQyanyhC",5,2,3,2022-09-20
185,2022-09-21 06:49:39+00:00,1572478144518713344,GoodPersonCoin,"#GPCX standing tall.  You can trade on #Bitmart and #Coinsbit exchanges. 
21.09.2022 Gpcx Price 0.001531 #USDT
#Bitcoin #Ethereum #NewListing #CryptoNews #HotNews #Crypto #Kripto #CryptoCurrency #KriptoPara #Bist #Putin #Usd #Fed https://t.co/5zS5nv2g1n",5,2,5,2022-09-21
187,2022-09-23 08:18:26+00:00,1573225261352599553,GoodPersonCoin,"Good Person Coin #GPCX price 0.001531 on #Bitmart 23.09.2022

#Bitcoin #Ethereum #Ripple #Russia #iran #HotNews #NewListing #CryptoCurrency #KriptoPara $XRP #Adana https://t.co/TmoKAXE9zq",2,2,1,2022-09-23
